{
  "id": "hymn-083",
  "collection": "hymns",
  "number": 83,
  "numberLabel": "Hino 83",
  "title": "FOI MORTO O SALVADOR",
  "subtitle": null,
  "variant": null,
  "groupKey": null,
  "attrs": {
    "section": "ATOS REDENTIVOS: RESSURREIÇÃO",
    "author": "Robert Lowry / Ricardo Pitrowsky"
  },
  "sortOrder": 83,
  "units": [
    {
      "id": "hymn-083-v1",
      "kind": "verse",
      "label": "1",
      "body": "Foi morto o Salvador\nE sepultado,\nMas dentre os mortos já\nRessuscitou.",
      "attrs": {},
      "sortOrder": 1
    },
    {
      "id": "hymn-083-ref1",
      "kind": "refrain",
      "label": null,
      "body": "Da sepultura saiu!\nCom triunfo e glória ressurgiu!\nRessurgiu, vencendo a morte e seu poder!\nPode agora a todos vida conceder!\nRessurgiu, ressurgiu!\nAleluia! Ressurgiu!",
      "attrs": {},
      "sortOrder": 2
    },
    {
      "id": "hymn-083-v2",
      "kind": "verse",
      "label": "2",
      "body": "Tomaram precaução\nCom seu sepulcro.\nFoi tudo em vão, porém,\nPara o deter.",
      "attrs": {},
      "sortOrder": 3
    },
    {
      "id": "hymn-083-v3",
      "kind": "verse",
      "label": "3",
      "body": "No grande Vencedor\nEis as primícias\nDos santos que também\nRessurgirão.",
      "attrs": {},
      "sortOrder": 4
    }
  ]
}
